{
  "schema_version": "jjukkumi.dispatch-plan/v1",
  "route": {
    "id": "wiki",
    "revision": "rev-1"
  },
  "resource_id": "vault-main",
  "changes": [
    {
      "path": "Inbox/new-note.md",
      "operation": "create",
      "exists_after": true,
      "file_type": "regular",
      "after_digest": "sha256:edb465624291e4053c6c5ea4b7eb320dec773e10a57d26b95dcf0564f8e310f8",
      "digest_status": "known"
    }
  ],
  "content_fingerprint": "sha256:dd56de4137951d9c92681b03416ec15f886b4482a27e3a517d32f085244cbe5d",
  "classification": [
    "normal"
  ],
  "disposition": "dispatch",
  "reason_codes": [
    "normal_batch"
  ],
  "required_capabilities": [
    "kanban.create",
    "kanban.lookup"
  ],
  "generation_action": "create_if_idle"
}
